{"artifact_hashes":{"config/pilot_design_v375.json":"dbc18b8d24dd2ef6f0d37ee23432c8cfe607cf2232c7936192b68072b2d62133","reports/step_04_OWNER_RUNBOOK.md":"867b350450a1f246f60ece492ecbbec3a49d1ac54cb4477c5860255f9a9cd2ee","reports/step_04_pilot_report_v375.json":"f968394f15b6479411f27df199bf3a3d7dc51d7ca08b559c84dde78959796802","reports/step_04_pilot_report_v375.md":"385752949ead8089cc7c01393781d6bd77d4d40ac915713b735474c32155e4c6","runs/kdenv375-s04-ordinary-20260913T100000Z-representative-pilot-v2/pilot/benchmark_segments":"b6f9ca7464cf5226f483a1685aee03769fa129e2e57fbd983a1c2dc7224812f2","runs/kdenv375-s04-ordinary-20260913T100000Z-representative-pilot-v2/pilot/manifests":"a66da63b6c403b759f636a4962af2b49edf83891a26482f2fccff43beec9a66c","runs/kdenv375-s04-ordinary-20260913T100000Z-representative-pilot-v2/pilot/precision":"13547db8f1bb215a33e0a6a7777b27cad5337a9bc236343df8746d5580417131","runs/kdenv375-s04-ordinary-20260913T100000Z-representative-pilot-v2/pilot/primary":"8760b365765f5ac6b917ae332dec00b6685dd81bda32bdaf96fb2ac1db90860b","runs/kdenv375-s04-ordinary-20260913T100000Z-representative-pilot-v2/pilot/progress":"a5ac5a6434f56f177e41c5174f879215e35d783bf366f86fa297ead4478350de","runs/kdenv375-s04-ordinary-20260913T100000Z-representative-pilot-v2/pilot/rebuild":"fd4a776f88199f0061819acfc5fed2eddc1283c60636a3b73b82f689577fa9ff","runs/kdenv375-s04-ordinary-20260913T100000Z-representative-pilot-v2/pilot/reports":"0337913a8add2db02ad9fc72fdbcf34f79643482804a03761ebaed1e47d89628","runs/kdenv375-s04-ordinary-20260913T100000Z-representative-pilot-v2/pilot/selection":"24734bf4e6f9907f13a55d9e0856472797dadaeb06de8689b2faf471d30727b8","src/kden_v375/pilot.py":"8cb6219f2dbff1be28d97869b1ffca2816d9e8669c08a74d3964aa3a4e1c3d83","src/kden_v375/steps/step_04_pilot.py":"b09b4b3b61f0932d9e12e35f2abc12e22ea8ed7d827dbcc793b1f5a5a3c83773"},"completed_at_utc":"2026-09-13T09:01:28.911015Z","gate_evidence":{"every_selector_validated_or_explicitly_blocked":true,"float32_comparison_completed":true,"four_and_eight_worker_benchmark_complete":true,"h16_q05_spatial_parity":true,"interruption_resume_duplicate_and_change_free":true,"no_ambiguous_repeated_q15_block_accepted":true,"physical_value_ranges_and_units":true,"pilot_rebuild_value_identical_and_hash_stable":true,"projected_disk_fits_with_safety_margin":true},"predecessor_hashes":{"STEP_00":"34d81da2f2b7d70e12eda2de72e5ff9e73c6f3bfaa1f31cbfe3488a2bde2cd8c","STEP_01":"fa71007a6d0c457135c6061f1783abfdc31f41dbd193cf73a2387c20ced1acae","STEP_02":"26ec04c8d411f3bb3c0b44f2534bcea562add3b4ff5c269654396ce7ad4317b7","STEP_03":"4c581157c746fc67215d52f59cccbcb9bebe30f5ac836aaa4349691503feb745"},"record_sha256":"a6b8db98a23f4365830d628890b7d31f4264c3526a32a12ea9f96e4c47800618","run_id":"kdenv375-s04-ordinary-20260913T100000Z-representative-pilot-v2","schema_version":"KDEN_V375_STEP_PASS_V1","status":"PASS","step_id":"STEP_04"}
