{"artifact_hashes":{"config/step_08_acceptance_v375.json":"b39b35d5875ae0313197d399553ef12a1dd6e1fe5e693418815e34ce9251d728","reports/kden_v375_acquisition_freeze_manifest.json":"340763a2eecaa7233dc6132010c994b57112339b94daec56d4b878ee80900280","reports/step_08_OWNER_RUNBOOK.md":"1f6ab3eae27d0d701a3885e314ba0c31d5f9552b80c69fa5111c2404440ad6d2","reports/step_08_final_acceptance_v375.json":"d2468c73cc5edaac269c8e3c700aacc37cc15c0f1159a14b194da8e88693a224","schemas/step_08_acceptance_v375.json":"6c669e879a3235db8dfefd1d8636658f5b8f199afe8c28063148e4880ebc0cba","src/kden_v375/acceptance/__init__.py":"36e909b1e0f0cb17e5625b993003ee12206c79fd41e4d8d1d806522b114cc6fc","src/kden_v375/acceptance/workflow.py":"6fb35baa9d7600c493e21d6dc0766ec0042c48282b7f497afda2953674c54dc3","src/kden_v375/steps/step_08_acceptance.py":"80395632bcff2c98da78920cc0fb06c59f76a05f28ed4673b7349075bcde0fe9","state/KDEN_V375_ACQUISITION_PASS.json":"a4c6daefe25658985aad14f8df5364fb7c44c900c09e9b189accd3423030ae4e"},"completed_at_utc":"2026-09-22T20:57:31.814957Z","gate_evidence":{"all_archive_units_deeply_verified":true,"all_logical_requests_reconciled":true,"checkpoint_and_journal_complete":true,"deterministic_bounded_rebuild_verified":true,"exact_r14_field_universe_verified":true,"expected_present_missing_reconciliation_verified":true,"expected_remote_missingness_verified":true,"independent_hourly_and_q05_archives_usable":true,"interval_semantics_verified":true,"kden_v375_acquisition_pass_sha256":"66c58ff231b1382c0a00e4aae0ae32c93e3c48255ce8ab3aa8a444c20cc37c1a","pilot_rebuild_evidence_verified":true,"schedule_and_right_open_window_verified":true,"source_selector_decoded_identity_verified":true,"spatial_geometry_units_and_physical_ranges_verified":true,"truth_madis_market_and_legacy_runtime_isolation_verified":true,"zero_quarantines_verified":true},"predecessor_hashes":{"STEP_07":"5d66348c7dc7bbba5beb4eb3f27a9e1b847c4e15abc4646da6f8c9849b8928c5"},"record_sha256":"2d525d3e7949adcb5e64781c858e3b7f2f7be7072ec917bd88eea087dbc4f85e","run_id":"kdenv375-s08-validation-20260922T101708Z-final-acceptance","schema_version":"KDEN_V375_STEP_PASS_V1","status":"PASS","step_id":"STEP_08"}
