{"artifact_hashes":{"config/issue_time_views_r14_v375.json":"2f0b0bf31ce05588e5ceb5152afeea5fbb4392dac055719b88ff78ba7c65ac9c","reports/step_07_OWNER_RUNBOOK.md":"2caf4a4fd6de74a729250a9044b8360de64521cdd25a48af73826fc35c05ac79","reports/step_07_archive_readers_report_v375.json":"280008bfad541f5ecb3474be3390217ed32f2127430ad5a9d3e5dc921bc7f23e","schemas/issue_time_view_r14_v375.json":"cad07a4f44ade4c4371d9dea652772de9e85f0244173c6b0ff6d76593a990de0","src/kden_v375/archive_readers.py":"3b9439c61e1601ee631136a24af61d3354ccc4b9aa92d722a30b8337a024913c","src/kden_v375/steps/step_07_archive_readers.py":"2b964ff65c948a964530b3bbd207c35a9b71239e4642ae6354b437c092033494"},"completed_at_utc":"2026-09-22T04:11:24.996927Z","gate_evidence":{"canonical_field_state_schema_verified":true,"combined_r14_pass_verified":true,"cross_product_alignment_contract_is_explicit":true,"cycle_revisions_use_identical_valid_time_support":true,"dst_safe_issue_grid":true,"explicit_missingness_is_preserved":true,"historical_l105_availability_enforced":true,"hourly_temperature_path_native_cadence":true,"q05_temperature_path_native_cadence":true,"r14_combined_pass_sha256":"0852fea463aaad9b4b65ce5c103c45605a0b13ccd338914911b025b1aff8ecfb","same_cycle_bundles_never_stitched":true,"static_h14_is_available":true,"truth_and_market_columns_absent":true,"views_are_on_demand_not_materialized":true},"predecessor_hashes":{},"record_sha256":"5d66348c7dc7bbba5beb4eb3f27a9e1b847c4e15abc4646da6f8c9849b8928c5","run_id":"kdenv375-s07-ordinary-20260922T040131Z-archive-readers","schema_version":"KDEN_V375_STEP_PASS_V1","status":"PASS","step_id":"STEP_07"}
