{"artifact_hashes":{"config/tile_shape_reattest_v375.json":"d1ade81da22bc1037a2abb7bf297c2cf4b7f4ed4d2274e4fd141f1a69519b42e","registries/availability_policies_v375.csv":"cf3cc4ac9cc372e62a568ef0cb802693a39bf6d2db9b194a8dd3e4ac7ae34cad","registries/decoded_grib_identities_v375.json":"5346e6ee256b5a540cd6e6826e4ba5542f6466f5990e70a54f1856406c112e50","registries/grid_geometry_v375.json":"f6f6826fc47f8ad1d66d142ef5073ccb3efc3c8e79f0aeed3765a3e34503e0be","registries/hrrr_hourly_v375.csv":"5bb048c7c9fe7f8c92e6d97e43cca71ec73cde2656edd97250540d7147eafb89","registries/hrrr_subhourly_v375.csv":"1241add588f02fc6e2919ded74c0763ce6358a52034f056aa29a3e616efe7faa","registries/registry_bundle_v375.json":"5c40620bc0a9f8ddb653c30cba601a2f4f7817cf4c9c4998499d7b9ccc097ca3","registries/station_coordinate_eras_v375.csv":"3a1656d6d714928789445b085ec15ef93cf301dbbf1da7410d30f1abf0b7c8cf","schemas/cycle_schedule_v375.json":"43d1b73a57bb4009fa7171783d3674e7e4f719d1cac9f53213e625c88f317489","schemas/hrrr_field_state_v375.json":"f18074f76340c05d2f2eca95234e9c6038bd06dc1664ec254ae82abd416b9729","schemas/request_plan_v375.json":"3cb2a4c24edde87d94e847fb956b64d85c82919052ed21c3f1c6d444cb373f1b","schemas/retrieval_ledger_v375.json":"0765d4db68fb058eda792642e9c337107d1407e3fa69ea90161767cf86731d57","schemas/temporal_coverage_v375.json":"101c56349fa39d72d8df563244f660b934fc915797d638897116d953a15e2b47","src/kden_v375/registries.py":"a1b9058371125897238adf3ecdd6b382fa2f4797c7f8d901b4301693f09fabc6","src/kden_v375/steps/step_01_registries.py":"d8438e1682a7bb62e712d2758674a1a9964e869c5515682110d80f636a5281ba","tools/reattest_tile_shape_v375.py":"a8e879d5498a97b51f8a3bc44fc5f8ba97a9537c94d92616a1e0673bc41baa7d"},"completed_at_utc":"2026-09-13T09:00:00.000000Z","gate_evidence":{"availability_policy":{"availability_policy_id":"KDEN_HIST_COMPLETE_L105_V1","lag_minutes":105,"products":["wrfsfcf","wrfsubhf"]},"contract_migration":{"contract_change":{"allowed_non_null_values":[[3,3],[9,9]],"column":"tile_shape","logical_semantics_changed":false,"new_arrow_type":"list<int16>","old_arrow_type":"fixed_size_list<int16,2>","path":"schemas/hrrr_field_state_v375.json"},"migration_id":"KDEN_V375_TILE_SHAPE_NULLABLE_LIST_REATTEST_V1","prior_attestations":{"STEP_00":"34d81da2f2b7d70e12eda2de72e5ff9e73c6f3bfaa1f31cbfe3488a2bde2cd8c","STEP_01":"559dffd7f80bb6316632d0605cd6266ff3a82cd2271cadbc481cb0d64c39c0d5","STEP_02":"ecace35c0f1650f7b75b8464ec83187db93c8c03c68c4a82837a77a43e4464c1","STEP_03":"b7a2f2e4ac10b75638a151af005adac14571ea4840e488741cb4eda1092f3163","STEP_03_WRFSFCF":"09dff0b1d12a87b733c958baa95d0d7c8ec83b743474ce3fca6c7dde27bd31f3","STEP_03_WRFSUBHF":"b49a62b26f0fe9e4748350dec7e74a2edf0a242be25d2b04f90e2d3d955cc3b5"},"request_plans_rebuilt":false,"schedule_rebuilt":false,"unchanged_payload_sha256":{"cycle_schedule_parquet":"15713595be6bfb0b83c2565b77d773096d2b468238dd4d44938350efbd3894e1","wrfsfcf_plan_directory":"1d3c95bf45f4d675de8d221fd33464604352f555c74ca36d6af9efa1efae960e","wrfsubhf_plan_directory":"3ef30db001b94b673c0da980491c41075760c2e274930743d929ac859c991d5a"}},"coordinate_eras":{"continuous_boundaries":true,"coordinate_era_count":3,"hrrrv4_coordinate_eras":["KDEN_COORD_20040105","KDEN_COORD_20211122"]},"dependency_isolation":{"artifacts_scanned":11,"forbidden_markers_found":0},"field_registries":{"hourly_field_count":44,"interval_contracts":{"H38":{"duration_minutes":60,"semantics":"preceding_accumulation","test_end_utc":"2021-01-01T12:00:00Z","test_start_utc":"2021-01-01T11:00:00Z"},"Q09":{"duration_minutes":5,"semantics":"preceding_average","test_end_utc":"2021-01-01T12:00:00Z","test_start_utc":"2021-01-01T11:55:00Z"},"Q10":{"duration_minutes":5,"semantics":"preceding_average","test_end_utc":"2021-01-01T12:00:00Z","test_start_utc":"2021-01-01T11:55:00Z"},"Q11":{"duration_minutes":15,"semantics":"preceding_average","test_end_utc":"2021-01-01T12:00:00Z","test_start_utc":"2021-01-01T11:45:00Z"},"Q13":{"duration_minutes":15,"semantics":"preceding_accumulation","test_end_utc":"2021-01-01T12:00:00Z","test_start_utc":"2021-01-01T11:45:00Z"}},"normal_network_acquisitions":["H16","Q05"],"single_acquisition_contract_per_field":true,"subhourly_field_count":14,"unique_selector_contract_count":58},"grid_geometry":{"bilinear_weight_tolerance":1e-12,"compact_tile_layout":"one row per field-state with row-major compact values array","coordinate_era_extraction_count":2,"grid_geometry_id":"HRRR_CONUS_NATIVE_LAMBERT_V4","nearest_node_rule":"floor(index_fraction+0.5) independently for i and j; deterministic half-up tie","operational_dimensions":[1059,1799]},"parquet_schemas":{"cycle_schedule_v375.json":{"arrow_type_grammar_validated":true,"column_count":24,"required_columns_present":true},"hrrr_field_state_v375.json":{"arrow_type_grammar_validated":true,"column_count":33,"required_columns_present":true},"request_plan_v375.json":{"arrow_type_grammar_validated":true,"column_count":15,"required_columns_present":true},"retrieval_ledger_v375.json":{"arrow_type_grammar_validated":true,"column_count":21,"required_columns_present":true},"temporal_coverage_v375.json":{"arrow_type_grammar_validated":true,"column_count":13,"required_columns_present":true}},"registry_bundle":{"artifact_count":11,"bundle_sha256":"89b0bfaa27a6fb8a7160e4d202eccd9f9035be7fd4474212b0ac83c5b60452a9","field_count":58,"self_contained":true}},"predecessor_hashes":{"STEP_00":"34d81da2f2b7d70e12eda2de72e5ff9e73c6f3bfaa1f31cbfe3488a2bde2cd8c"},"record_sha256":"fa71007a6d0c457135c6061f1783abfdc31f41dbd193cf73a2387c20ced1acae","run_id":"kdenv375-s01-validation-20260913T090000Z-tile-shape-reattest","schema_version":"KDEN_V375_STEP_PASS_V1","status":"PASS","step_id":"STEP_01"}
