{"artifact_hashes":{"config/request_plan_v375.toml":"7c2e2f17b9b68cd42cb199bf68f57eb479f6d5a35ddaf96d1854844cf48e77b8","hrrr_v4_local_archive/wrfsfcf/manifests/plan_wrfsfcf":"1d3c95bf45f4d675de8d221fd33464604352f555c74ca36d6af9efa1efae960e","hrrr_v4_local_archive/wrfsfcf/manifests/plan_wrfsfcf_v375_manifest.json":"240c06e20c10a8939c9ec7983d308b085c2e64c44a5bf75de09f01281ae7789c","hrrr_v4_local_archive/wrfsubhf/manifests/plan_wrfsubhf":"3ef30db001b94b673c0da980491c41075760c2e274930743d929ac859c991d5a","hrrr_v4_local_archive/wrfsubhf/manifests/plan_wrfsubhf_v375_manifest.json":"0b8daf729ec1c6c4722dc72d5f9e2a34c11fc8c324452fc2251a0064f064c65b","reports/step_03_cost_disk_projection_v375.json":"bed09a36233704943bc211e3af38260b57bd4f2e137c91de4673413d7f6b3282","reports/step_03_fh00_selector_evidence_v375.json":"d220aea557fae79aa702c5a8f9376cfd0cd9226890a315096d0adf928c859320","src/kden_v375/request_plans.py":"029fd9fcd4b44101e4e73250b2a33b5186ed063a4736f8792be50444c95c0252","src/kden_v375/steps/step_03_request_plans.py":"60d73647e8680bfede223c3de2d826fa7c7099ba2ff541cd1d145b710a915810","state/STEP_03_WRFSFCF_PASS.json":"aa0f4bb2dc42496e749cbcf5816e959bfdbf6d07c8870e4f824a1f025dbc9447","state/STEP_03_WRFSUBHF_PASS.json":"80a975498a3a27fa37ea102a30b4e67700a43f3339c4521eb2b5a52356335ced"},"completed_at_utc":"2026-09-13T09:02:00.000000Z","gate_evidence":{"H14_planned_once_per_grid_version":true,"H16_network_request_count":585085,"Q05_network_request_count":2173943,"contract_migration":{"contract_change":{"allowed_non_null_values":[[3,3],[9,9]],"column":"tile_shape","logical_semantics_changed":false,"new_arrow_type":"list<int16>","old_arrow_type":"fixed_size_list<int16,2>","path":"schemas/hrrr_field_state_v375.json"},"migration_id":"KDEN_V375_TILE_SHAPE_NULLABLE_LIST_REATTEST_V1","prior_attestations":{"STEP_00":"34d81da2f2b7d70e12eda2de72e5ff9e73c6f3bfaa1f31cbfe3488a2bde2cd8c","STEP_01":"559dffd7f80bb6316632d0605cd6266ff3a82cd2271cadbc481cb0d64c39c0d5","STEP_02":"ecace35c0f1650f7b75b8464ec83187db93c8c03c68c4a82837a77a43e4464c1","STEP_03":"b7a2f2e4ac10b75638a151af005adac14571ea4840e488741cb4eda1092f3163","STEP_03_WRFSFCF":"09dff0b1d12a87b733c958baa95d0d7c8ec83b743474ce3fca6c7dde27bd31f3","STEP_03_WRFSUBHF":"b49a62b26f0fe9e4748350dec7e74a2edf0a242be25d2b04f90e2d3d955cc3b5"},"request_plans_rebuilt":false,"schedule_rebuilt":false,"unchanged_payload_sha256":{"cycle_schedule_parquet":"15713595be6bfb0b83c2565b77d773096d2b468238dd4d44938350efbd3894e1","wrfsfcf_plan_directory":"1d3c95bf45f4d675de8d221fd33464604352f555c74ca36d6af9efa1efae960e","wrfsubhf_plan_directory":"3ef30db001b94b673c0da980491c41075760c2e274930743d929ac859c991d5a"}},"fh48_only_tail_absent":true,"forbidden_dependency_columns":[],"independent_product_pass_record_sha256":{"wrfsfcf":"a2494c06b0dd3ddf0508bf8148b1718236cad951661a91ece528ac28500c4e30","wrfsubhf":"649b1de498a7599589984ed12609f3b35266d396fba7204c6ae2a3d748a64e80"},"products":{"wrfsfcf":{"independently_loadable":true,"native_valid_state_count":585085,"plan_sha256":"7ab9afd499c8c72855e667f58f41c25e86cbdb43652bbc051b5bbcd54b4e9a81","request_row_count":25158656,"unique_source_object_count":585085},"wrfsubhf":{"independently_loadable":true,"native_valid_state_count":2173943,"plan_sha256":"1ae7ff7efabc167efde8a6864358d2f713cbca86ff23ede8775a63a3f973bddb","request_row_count":30435202,"unique_source_object_count":568445}},"projection_status":"PRE_PILOT_DRY_RUN","sealed_before_network_execution":true,"target_window_cap_verified":true},"predecessor_hashes":{"STEP_00":"34d81da2f2b7d70e12eda2de72e5ff9e73c6f3bfaa1f31cbfe3488a2bde2cd8c","STEP_01":"fa71007a6d0c457135c6061f1783abfdc31f41dbd193cf73a2387c20ced1acae","STEP_02":"26ec04c8d411f3bb3c0b44f2534bcea562add3b4ff5c269654396ce7ad4317b7"},"record_sha256":"4c581157c746fc67215d52f59cccbcb9bebe30f5ac836aaa4349691503feb745","run_id":"kdenv375-s03-validation-20260913T090200Z-plan-reattest","schema_version":"KDEN_V375_STEP_PASS_V1","status":"PASS","step_id":"STEP_03"}
