{"artifact_hashes":{"README.md":"20f3543973380eb7bfb0ce65ed8904abab6f074bc8a81b36f8fd145f88dd6933","config/project_v375.toml":"82213148845728c74611d3eaf09ca4b8e44118806f7e558a019ee4ef43de4dbb","config/wrfsfcf_4w.toml":"1d8567b28852c6925d0d63570d42779bfbb200e9c2b02ef265fcab87fe3e4e6c","config/wrfsfcf_8w.toml":"7b156351ffd536feae12b7617e8c1331bcc00780ff5a5cec1329097861c4918b","config/wrfsubhf_4w.toml":"21c6c9c66dc36ec5530fe412a3889a1a7a46ab327042a7cc1ee67de206b6b412","config/wrfsubhf_8w.toml":"55476c16b7e98f3e963dcd7ccc0837f3bbd43cda876ac16c1e1f201b59b6e5e1","environment/build-requirements.lock":"1ac318d288530f12790ac6c5c39385e5464510dc1ac6a6f9e5dbf3e5b262ff74","environment/environment_v375.json":"3dd5da7f929fe22cbe2e4732a8d461ca3c3bfe04fa8cf34646398cf67f9c6810","environment/requirements.lock":"694a338ad6276028afb710c90ececae504006fc7d1d0cbc2d0e2d9a00f5182b7","pyproject.toml":"025296d9ea4d843b35e70360663aea8b3c6ccf6d17c1f48bb7af3791f863e74c","schemas/log_event_v375.json":"714c5eccf7fe00da04bcc7472a0223e140761cccb0ec9dfde8e70e493664d4bf","schemas/run_state_v375.json":"87fbe216758ec4fcc7e02f4d3d04feac00efa110807ae366f6828d7e453c58b6","schemas/step_pass_v375.json":"20507af6a176615e98058a4b3ce3bc8c217b13086bfbfc610de94db5364aacaf","src/kden_v375/__init__.py":"5ed3207bf4ada3783e3b5ecae3912e3440f2864a274726243f653cc6c0f94442","src/kden_v375/__main__.py":"a57b06ba5d95a27afe8617b3a4f097cfbe8dc7375a1008103c504ca59f35190a","src/kden_v375/accounting.py":"69203ca9dd2a15ea29469e4065fb4433924dceace65243d1230152d823569db2","src/kden_v375/cli.py":"7dcb7055d975480769dfca60aad549aa34d0efca5de1395473fbaec26cda827a","src/kden_v375/contracts.py":"ab7236e593efaa4941f1fca9cea5012d80808eaa734ac96ab569b12943b0aeb2","src/kden_v375/execution.py":"fafb1352b7ebaa49ebe73756d313e5c44af913a0affaf4d742cf4243b88e5f23","src/kden_v375/hashes.py":"448249cf90c743a196ba3cf042ffc019d1cc9cfbd460026983672878c567cbb8","src/kden_v375/io/__init__.py":"082c4bb7b53fceec01fbb8c0e579639753746147b35f6e3ee3ea3242a4ffcd93","src/kden_v375/io/atomic.py":"f04e572124bbbfd55a0869eb17b324996719dcda18dea6eb08b93146af3b9223","src/kden_v375/io/cache.py":"7be8f180d1b53bb6bb406a803b1311bb2df7bc9d89b2033b6e3a51d70a07979c","src/kden_v375/io/grib.py":"d192263b62fa8df3fa1c5b33f41acea858ad1cc22f4a87beb62ef0f7e74f92dc","src/kden_v375/io/http_range.py":"d16ad97e291e2b48ce66c6b831c35292b3de58ed98f2735f4c3558dc6b5ced95","src/kden_v375/io/parquet.py":"efa1a6537c019281dfe717efedd37a53d4f1f99daffd54da6229a78dc080dd34","src/kden_v375/logging.py":"e49dbec6657dac9bf69c97d441703897d48db37da4fc004a00183847ed4c25c3","src/kden_v375/planning.py":"6bb8ae00ac2ddbacfea2b7f40a775824c571db5b83fc7e627fc130a99adec357","src/kden_v375/progress.py":"2383c4ffcf075333eb4f48c8a5c355a06e75250be2fee5f34a31657f115e543a","src/kden_v375/steps/__init__.py":"11fb8d4c183b7210309d1e53705be108b8785dfc98b963ffdec5f2b922a1c17e","src/kden_v375/steps/step_00_initialize.py":"7df2f3fef9ae817fdccc13f9c7e99a6949040b01126c900d73a166da059e29d3","src/kden_v375/time.py":"9478072b4d333b5cb4a198bd6fa56b77fc9cf6f527843ca1cab4fa947fa1f4a2"},"completed_at_utc":"2026-09-13T03:03:42.855415Z","gate_evidence":{"atomic_publication":{"directory_promotion_verified":true,"interrupted_destination_unchanged":true,"rule":"write-fsync-hash-replace-fsync-parent","temporary_sibling_cleaned":true},"clean_installation":{"distribution":"kden-v375","importable":true,"version":"0.1.0"},"dependency_freeze":{"exactly_pinned_entries":15,"python_contract":">=3.12,<3.13"},"interruption_resume":{"duplicate_records":0,"expected_units":3,"post_resume_completed":3,"pre_pause_completed":1,"published_hashes_reverified":true},"retrieval_primitives":{"constituent_hashes_preserved":true,"exact_adjacent_members":2,"exact_content_range":true,"full_selector_match_count":1,"verified_http_206":true},"runtime_isolation":{"absolute_user_paths_found":0,"denied_import_prefixes":["kden35","kden_panel"],"legacy_runtime_references_found":0,"package_root":"src/kden_v375","source_files_scanned":29},"shared_acquisition_primitives":{"accepted_bytes_reconciled":9,"bounded_workers":2,"deterministic_commits":4,"partial_cache_quarantined":true,"planned_requests_reconciled":2,"retry_count_reconciled":1,"sealed_cache_roundtrip":true,"single_coordinator_commit":true}},"predecessor_hashes":{},"record_sha256":"34d81da2f2b7d70e12eda2de72e5ff9e73c6f3bfaa1f31cbfe3488a2bde2cd8c","run_id":"kdenv375-s00-synthetic-20260913T030000Z-final-dispatch","schema_version":"KDEN_V375_STEP_PASS_V1","status":"PASS","step_id":"STEP_00"}
