{"artifact_hashes":{"config/cycle_schedule_v375.toml":"acda9f3305bea9c19e0129086b854b6ce4c14c5281f8718f5571316b2975e06f","hrrr_v4_local_archive/common/cycle_schedule/cycle_schedule_v375.parquet":"15713595be6bfb0b83c2565b77d773096d2b468238dd4d44938350efbd3894e1","hrrr_v4_local_archive/common/cycle_schedule/cycle_schedule_v375_manifest.json":"77c917c5db6d6dc8c4c81824f8ab17bb313abb877d474fbee407bed4fb461f99","reports/step_02_horizon_discovery_v375.json":"839238d3421af92207e559bc5466a503180742c3543c251f0fcd38a49f9a8b1d","src/kden_v375/schedule.py":"129b1482282ebc084cc9f08ecbfb079b4223d6f9e7af080fb72e0ff7b18e12e9","src/kden_v375/steps/step_02_cycle_schedule.py":"988772187824e823c3ed34b3d721343ca9ea95ad25fce5a94e9c6b59065dc41c"},"completed_at_utc":"2026-09-13T09:01:00.000000Z","gate_evidence":{"contract_migration":{"contract_change":{"allowed_non_null_values":[[3,3],[9,9]],"column":"tile_shape","logical_semantics_changed":false,"new_arrow_type":"list<int16>","old_arrow_type":"fixed_size_list<int16,2>","path":"schemas/hrrr_field_state_v375.json"},"migration_id":"KDEN_V375_TILE_SHAPE_NULLABLE_LIST_REATTEST_V1","prior_attestations":{"STEP_00":"34d81da2f2b7d70e12eda2de72e5ff9e73c6f3bfaa1f31cbfe3488a2bde2cd8c","STEP_01":"559dffd7f80bb6316632d0605cd6266ff3a82cd2271cadbc481cb0d64c39c0d5","STEP_02":"ecace35c0f1650f7b75b8464ec83187db93c8c03c68c4a82837a77a43e4464c1","STEP_03":"b7a2f2e4ac10b75638a151af005adac14571ea4840e488741cb4eda1092f3163","STEP_03_WRFSFCF":"09dff0b1d12a87b733c958baa95d0d7c8ec83b743474ce3fca6c7dde27bd31f3","STEP_03_WRFSUBHF":"b49a62b26f0fe9e4748350dec7e74a2edf0a242be25d2b04f90e2d3d955cc3b5"},"request_plans_rebuilt":false,"schedule_rebuilt":false,"unchanged_payload_sha256":{"cycle_schedule_parquet":"15713595be6bfb0b83c2565b77d773096d2b468238dd4d44938350efbd3894e1","wrfsfcf_plan_directory":"1d3c95bf45f4d675de8d221fd33464604352f555c74ca36d6af9efa1efae960e","wrfsubhf_plan_directory":"3ef30db001b94b673c0da980491c41075760c2e274930743d929ac859c991d5a"}},"horizon_discovery":{"archive_years_sampled":[2021,2024,2026],"evidence_id":"KDEN_V375_HRRR_HORIZON_DISCOVERY_V1","hourly_extended_cycle_hours_utc":[0,6,12,18],"hourly_extended_max_forecast_hour":48,"hourly_ordinary_max_forecast_hour":18,"probe_group_count":4,"source_root":"https://noaa-hrrr-bdp-pds.s3.amazonaws.com","subhourly_max_forecast_hour":18},"publication":{"compression":"zstd","logical_schedule_sha256":"76faaf97f7e9413d5a1bbf1abdb9d80f9ef528b3f942274249d4c2e9c5e6afe2","parquet_roundtrip_verified":true,"parquet_sha256":"15713595be6bfb0b83c2565b77d773096d2b468238dd4d44938350efbd3894e1","schema_roundtrip_verified":true},"schedule":{"all_cycles_begin_at_fh00":true,"all_retained_endpoints_at_or_before_window_end":true,"dst_transition_tests":[{"cycle_count":15,"in_historical_range":true,"target_day":"2021-03-14"},{"cycle_count":17,"in_historical_range":true,"target_day":"2021-11-07"},{"cycle_count":15,"in_historical_range":true,"target_day":"2022-03-13"},{"cycle_count":17,"in_historical_range":true,"target_day":"2022-11-06"},{"cycle_count":15,"in_historical_range":true,"target_day":"2023-03-12"},{"cycle_count":17,"in_historical_range":true,"target_day":"2023-11-05"},{"cycle_count":15,"in_historical_range":true,"target_day":"2024-03-10"},{"cycle_count":17,"in_historical_range":true,"target_day":"2024-11-03"},{"cycle_count":15,"in_historical_range":true,"target_day":"2025-03-09"},{"cycle_count":17,"in_historical_range":true,"target_day":"2025-11-02"},{"cycle_count":15,"in_historical_range":true,"target_day":"2026-03-08"},{"cycle_count":17,"in_historical_range":false,"target_day":"2026-11-01"}],"first_source_local_date":"2020-12-31","horizon_class_counts":{"wrfsfcf":{"extended":6240,"ordinary":27039},"wrfsubhf":{"ordinary":33279}},"per_product_cycle_count":{"wrfsfcf":33279,"wrfsubhf":33279},"target_date_count":2080,"target_date_cycle_classes":{"fall_back_17":5,"ordinary_16":2069,"spring_forward_15":6},"target_window_capped_cycle_counts":{"wrfsfcf":19422,"wrfsubhf":15262},"total_product_cycle_count":66558,"utc_cycle_keys_unique_per_product":true}},"predecessor_hashes":{"STEP_00":"34d81da2f2b7d70e12eda2de72e5ff9e73c6f3bfaa1f31cbfe3488a2bde2cd8c","STEP_01":"fa71007a6d0c457135c6061f1783abfdc31f41dbd193cf73a2387c20ced1acae"},"record_sha256":"26ec04c8d411f3bb3c0b44f2534bcea562add3b4ff5c269654396ce7ad4317b7","run_id":"kdenv375-s02-validation-20260913T090100Z-schedule-reattest","schema_version":"KDEN_V375_STEP_PASS_V1","status":"PASS","step_id":"STEP_02"}
